{
  "format": "cuicui.render_spec",
  "version": 1,
  "sample_rate": 48000,
  "duration_s": 0.4,
  "seed": 3,
  "oversampling": "auto",
  "params": {
    "resp.pressure": 0.7,
    "src.L.beta": 0.55,
    "src.L.gate": 1.0,
    "src.R.gate": 0.0,
    "noise.beta_sigma": 0.02,
    "noise.beta_bandwidth_hz": 400.0,
    "noise.aspiration": 0.08,
    "body.size": 1.0,
    "src.gamma": 24000.0,
    "trachea.length_mm": 33.0,
    "trachea.reflection": 0.5,
    "trachea.loss": 0.2,
    "oec.freq_hz": 2800.0,
    "beak.gape": 0.7,
    "out.gain_db": 0.0
  }
}
