{
  "format": "cuicui.render_spec",
  "version": 1,
  "sample_rate": 48000,
  "duration_s": 1.0,
  "seed": 1,
  "oversampling": "auto",
  "params": {
    "test.gain_db": -12.0
  },
  "automation": {
    "test.freq_hz": [
      [0.0, 100.0],
      [1.0, 8000.0]
    ]
  },
  "automation_interp": "linear",
  "output": {
    "normalize_peak_dbfs": null
  }
}
