{
  "format": "cuicui.render_spec",
  "version": 1,
  "sample_rate": 48000,
  "duration_s": 3.2,
  "seed": 2,
  "oversampling": "auto",
  "params": {
    "body.size": 1.0,
    "src.gamma": 24000.0,
    "noise.beta_sigma": 0.0,
    "noise.aspiration": 0.0,
    "trachea.length_mm": 33.0,
    "oec.freq_hz": 3200.0,
    "out.gain_db": 0.0
  },
  "automation": {
    "resp.pressure": [
      [0.00, 0.00], [0.03, 0.55], [0.48, 0.55], [0.52, 0.00],
      [0.70, 0.00], [0.73, 0.58], [1.18, 0.58], [1.22, 0.00],
      [1.40, 0.00], [1.43, 0.60], [2.10, 0.60], [2.15, 0.00],
      [2.35, 0.00], [2.38, 0.62], [3.05, 0.62], [3.12, 0.00]
    ],
    "src.L.beta": [
      [0.00, 0.18], [3.12, 0.18]
    ],
    "src.R.beta": [
      [0.00, 0.42], [3.12, 0.42]
    ],
    "src.L.gate": [
      [0.00, 1.0], [0.52, 1.0], [0.53, 0.0],
      [1.40, 0.0], [1.41, 1.0], [1.716, 1.0], [1.724, 0.0],
      [2.35, 0.0], [2.36, 1.0], [3.12, 1.0]
    ],
    "src.R.gate": [
      [0.00, 0.0], [0.69, 0.0], [0.70, 1.0], [1.22, 1.0], [1.23, 0.0],
      [1.40, 0.0], [1.716, 0.0], [1.724, 1.0], [2.15, 1.0], [2.16, 0.0],
      [2.35, 0.0], [2.36, 1.0], [3.12, 1.0]
    ]
  }
}
