{
  "format": "cuicui.render_spec",
  "version": 1,
  "sample_rate": 48000,
  "duration_s": 0.8,
  "seed": 4,
  "oversampling": "auto",
  "params": {
    "src.L.gate": 1.0,
    "src.R.gate": 0.0,
    "noise.beta_sigma": 0.0,
    "noise.aspiration": 0.0,
    "body.size": 1.0,
    "src.gamma": 24000.0,
    "trachea.length_mm": 33.0,
    "oec.freq_hz": 3000.0,
    "out.gain_db": 0.0
  },
  "automation": {
    "resp.pressure": [
      [0.0, 0.0], [0.02, 0.6], [0.12, 0.6], [0.14, 0.0],
      [0.18, 0.0], [0.20, 0.65], [0.32, 0.65], [0.34, 0.0],
      [0.40, 0.0], [0.42, 0.7], [0.58, 0.7], [0.62, 0.0],
      [0.80, 0.0]
    ],
    "src.L.beta": [
      [0.0, 0.15], [0.14, 0.15],
      [0.18, 0.28], [0.34, 0.28],
      [0.40, 0.45], [0.62, 0.22],
      [0.80, 0.22]
    ]
  }
}
